Meeting,Meeting Date,Origin,Index Title,Title,Published,Page URL,PDF URL
SAGE 62,2020-10-15,SPI-M-O,"SPI-M-O: Summary of SAGE advice on segmentation, 15 October 2020",SPI-M-O: Summary of SAGE advice on segmentation - 15 October 2020,2020-10-23,https://www.gov.uk/government/publications/spi-m-o-summary-of-sage-advice-on-segmentation-15-october-2020,https://assets.publishing.service.gov.uk/government/uploads/system/uploads/attachment_data/file/928740/S0810_Summary_of_SAGE_advice_on_segmentation.pdf
SAGE 62,2020-10-15,SPI-M-O,"SPI-M-O: Consensus statement on COVID-19, 15 October 2020",SPI-M-O: Consensus Statement on COVID-19 - 15 October 2020,2020-10-30,https://www.gov.uk/government/publications/spi-m-o-consensus-statement-on-covid-19-15-october-2020,https://assets.publishing.service.gov.uk/government/uploads/system/uploads/attachment_data/file/931162/S0808_SAGE62_201014_SPI-M-O_Consensus_Statement.pdf
SAGE 62,2020-10-15,Dynamic CO-CIN report,Dynamic CO-CIN report to SAGE and NERVTAG (recent cases),Dynamic CO-CIN report to SAGE and NERVTAG (Recent cases),2020-10-30,https://www.gov.uk/government/publications/dynamic-co-cin-report-to-sage-and-nervtag-recent-cases,https://assets.publishing.service.gov.uk/government/uploads/system/uploads/attachment_data/file/931167/S0817_Dynamic_CO-CIN_report_to_SAGE_and_NERVTAG.pdf
SAGE 62,2020-10-15,Dynamic CO-CIN report,Dynamic CO-CIN report to SAGE and NERVTAG (all cases),Dynamic CO-CIN report to SAGE and NERVTAG (All cases),2020-10-30,https://www.gov.uk/government/publications/dynamic-co-cin-report-to-sage-and-nervtag-all-cases,https://assets.publishing.service.gov.uk/government/uploads/system/uploads/attachment_data/file/931171/S0818_Dynamic_CO-CIN_report_to_SAGE_and_NERVTAG.pdf
SAGE 62,2020-10-15,SPI-M-O,"SPI-M-O: Medium-term projections, 14 October 2020","SPI-M-O: Medium-term projections, 14 October 2020",2020-12-18,https://www.gov.uk/government/publications/spi-m-o-medium-term-projections-draft-14-october-2020,https://assets.publishing.service.gov.uk/government/uploads/system/uploads/attachment_data/file/949585/S0809_SPI-M_MediumTermProjections.pdf
SAGE 63,2020-10-22,SAGE Minutes,"SAGE 63 minutes: Coronavirus (COVID-19) response, 22 October 2020",Sixty-third SAGE meeting on COVID-19 - 22 October 2020,2020-11-13,https://www.gov.uk/government/publications/sage-63-minutes-coronavirus-covid-19-response-22-october-2020,https://assets.publishing.service.gov.uk/government/uploads/system/uploads/attachment_data/file/935103/sage-63-meeting-covid-19-s0842.pdf
SAGE 63,2020-10-22,EMG and NERVTAG,"SARS-COV-2: Transmission Routes and Environments, 22 October 2020",SARS-COV-2: Transmission Routes and Environments,2020-11-06,https://www.gov.uk/government/publications/sars-cov-2-transmission-routes-and-environments-22-october-2020,https://assets.publishing.service.gov.uk/government/uploads/system/uploads/attachment_data/file/933225/S0824_SARS-CoV-2_Transmission_routes_and_environments.pdf
SAGE 63,2020-10-22,NERVTAG,"NERVTAG: Seasonality and its impact on COVID-19, 22 October 2020",Seasonality and its impact on COVID-19,2020-11-06,https://www.gov.uk/government/publications/nervtag-seasonality-and-its-impact-on-covid-19-22-october-2020,https://assets.publishing.service.gov.uk/government/uploads/system/uploads/attachment_data/file/933226/S0825_NERVTAG-EMG_Seasonality_and_its_impact_on_COVID-19.pdf
SAGE 63,2020-10-22,SPI-B,"SPI-B: Positive strategies for sustaining adherence to infection control behaviours, 22 October 2020",SPI-B: Positive strategies for sustaining adherence to infection control behaviours,2020-11-06,https://www.gov.uk/government/publications/spi-b-positive-strategies-for-sustaining-adherence-to-infection-control-behaviours-22-october-2020,https://assets.publishing.service.gov.uk/government/uploads/system/uploads/attachment_data/file/933227/S0828_SPI-B_-_Positive_strategies_for_sustaining_adherence_to_infection_control_behaviours.pdf
SAGE 63,2020-10-22,SPI-B,"SPI-B: Increasing adherence to COVID-19 preventative behaviours among young people, 22 October 2020",SPI-B: Increasing adherence to COVID-19 preventative behaviours among young people,2020-11-06,https://www.gov.uk/government/publications/spi-b-increasing-adherence-to-covid-19-preventative-behaviours-among-young-people-22-october-2020,https://assets.publishing.service.gov.uk/government/uploads/system/uploads/attachment_data/file/933228/S0829_SPI-B_-_Increasing_adherence_to_Covid-19_preventative_behaviours_among_young_people.pdf
SAGE 63,2020-10-22,SPI-B,"Role of Community Champions networks to increase engagement in context of COVID-19: evidence and best practice, 22 October 2020",The role of Community Champions networks to increase engagement in the context of COVID-19: Evidence and best practice,2020-11-06,https://www.gov.uk/government/publications/role-of-community-champions-networks-to-increase-engagement-in-context-of-covid-19-evidence-and-best-practice-22-october-2020,https://assets.publishing.service.gov.uk/government/uploads/system/uploads/attachment_data/file/933231/S0830_SPI-B_-_Community_Champions_evidence_and_best_practice.pdf
SAGE 63,2020-10-22,Dynamic CO-CIN report,"Dynamic CO-CIN report to SAGE and NERVTAG (recent cases), 22 October 2020",Dynamic CO-CIN report to SAGE and NERVTAG (recent cases),2020-11-06,https://www.gov.uk/government/publications/dynamic-co-cin-report-to-sage-and-nervtag-recent-cases-22-october-2020,https://assets.publishing.service.gov.uk/government/uploads/system/uploads/attachment_data/file/933233/S0834_Dynamic_CO-CIN_report_to_SAGE_and_NERVTAG__Recent_cases_.pdf
SAGE 63,2020-10-22,Dynamic CO-CIN report,"Dynamic CO-CIN report to SAGE and NERVTAG (all cases), 22 October 2020",Dynamic CO-CIN report to SAGE and NERVTAG (All cases),2020-11-06,https://www.gov.uk/government/publications/dynamic-co-cin-report-to-sage-and-nervtag-all-cases-22-october-2020,https://assets.publishing.service.gov.uk/government/uploads/system/uploads/attachment_data/file/933234/S0835_Dynamic_CO-CIN_report_to_SAGE_and_NERVTAG__All_cases_.pdf
SAGE 63,2020-10-22,SPI-M-O,"SPI-M-O: Medium-term projections, 21 October 2020",SPI-M-O: Medium-term projections - 21 October 2020,2020-12-18,https://www.gov.uk/government/publications/spi-m-o-medium-term-projections-draft-21-october-2020,https://assets.publishing.service.gov.uk/government/uploads/system/uploads/attachment_data/file/949582/S0822_SPI-M_MediumTermProjections.pdf
SAGE 63,2020-10-22,SPI-M-O,"SPI-M-O: Consensus statement on COVID-19, 21 October 2020",SPI-M-O: Consensus statement on COVID-19 - 21 October 2020,2021-01-08,https://www.gov.uk/government/publications/spi-m-o-consensus-statement-on-covid-19-21-october-2020,https://assets.publishing.service.gov.uk/government/uploads/system/uploads/attachment_data/file/950631/S0821_SPI-M-O_Consensus_Statement.pdf
SAGE 64,2020-10-29,CO-CIN,"CO-CIN: Delayed adoption of corticosteroids as standard of care for hypoxic patients with COVID-19 in the UK, 29 October 2020",Delayed adoption of corticosteroids as standard of care for hypoxic patients with COVID-19 in the UK - 29 October 2020,2020-11-13,https://www.gov.uk/government/publications/co-cin-delayed-adoption-of-corticosteroids-as-standard-of-care-for-hypoxic-patients-with-covid-19-in-the-uk-29-october-2020,https://assets.publishing.service.gov.uk/government/uploads/system/uploads/attachment_data/file/935215/co-cin-delayed-adoption-steroids-covid-19-patients-s0846-291020.pdf
SAGE 64,2020-10-29,,"Potential trajectories for COVID-19 in the next 6 months, 29 October 2020",Potential trajectories for COVID-19 in the next 6 months - 29 October 2020,2020-11-13,https://www.gov.uk/government/publications/potential-trajectories-for-covid-19-in-the-next-6-months-29-october-2020,https://assets.publishing.service.gov.uk/government/uploads/system/uploads/attachment_data/file/935238/potential-trajectories-covid-190next-6-months-s0848-291020.pdf
SAGE 64,2020-10-29,SPI-M-O,"SPI-M-O: COVID-19: Possible scenarios for the coming months, 28 October 2020",SPI-M-O: Possible scenarios for the coming months - 28 October 2020,2020-11-13,https://www.gov.uk/government/publications/spi-m-o-covid-19-possible-scenarios-for-the-coming-months-28-october-2020,https://assets.publishing.service.gov.uk/government/uploads/system/uploads/attachment_data/file/935205/spi-m-o-covid-19-possible-scenarios-coming-months-281020-s0847.pdf
SAGE 64,2020-10-29,Dynamic CO-CIN report,"Dynamic CO-CIN report to SAGE and NERVTAG (all cases), 28 October 2020",Dynamic CO-CIN report to SAGE and NERVTAG (all cases) - 28 October 2020,2020-11-13,https://www.gov.uk/government/publications/dynamic-co-cin-report-to-sage-and-nervtag-all-cases-28-october-2020,https://assets.publishing.service.gov.uk/government/uploads/system/uploads/attachment_data/file/935139/dynamic-co-cin-report-sage-nervtag-all-cases-s0854-281011.pdf
SAGE 64,2020-10-29,Dynamic CO-CIN report,"Dynamic CO-CIN report to SAGE and NERVTAG (recent cases), 28 October 2020","Dynamic CO-CIN report to SAGE and NERVTAG (recent cases), 28 October 2020",2020-11-13,https://www.gov.uk/government/publications/dynamic-co-cin-report-to-sage-and-nervtag-recent-cases-28-october-2020,https://assets.publishing.service.gov.uk/government/uploads/system/uploads/attachment_data/file/935143/dynamic-co-cin-report-sage-nervtag-recent-cases-s0854-281011.pdf
SAGE 64,2020-10-29,SAGE Minutes,"SAGE 64 minutes: Coronavirus (COVID-19) response, 29 October 2020",Sixty-fourth SAGE meeting on COVID-19 - 29 October 2020,2020-11-27,https://www.gov.uk/government/publications/sage-64-minutes-coronavirus-covid-19-response-29-october-2020,https://assets.publishing.service.gov.uk/government/uploads/system/uploads/attachment_data/file/938973/S0859_Sixty-fourth_SAGE_meeting_on_Covid-19.pdf
SAGE 64,2020-10-29,SPI-B,"SPI-B: Insights on celebrations and observances during COVID-19, 29 October 2020",SPI-B: Insights on celebrations and observances during COVID-19: executive summary - 29 October 2020,2020-11-27,https://www.gov.uk/government/publications/spi-b-insights-on-celebrations-and-observances-during-covid-19-29-october-2020,https://assets.publishing.service.gov.uk/government/uploads/system/uploads/attachment_data/file/939147/S0849_SPI-B_Executive_Summary_-_Insights_on_Celebrations_and_Observances_during_COVID-19.pdf
SAGE 64,2020-10-29,SPI-M-O,"SPI-M-O: Consensus statement on COVID-19, 28 October 2020",SPI-M-O: Consensus statement on COVID-19 - 28 October 2020,2020-11-27,https://www.gov.uk/government/publications/spi-m-o-consensus-statement-on-covid-19-28-october-2020,https://assets.publishing.service.gov.uk/government/uploads/system/uploads/attachment_data/file/939163/S0843_SAGE64_201028_SPI-M-O_Consensus_Statement.pdf
SAGE 64,2020-10-29,SPI-M-O,"SPI-M-O: Medium-term projections and scenarios, 28 October 2020","SPI-M-O: Medium-term projections and scenarios, 28 October 2020",2020-12-18,https://www.gov.uk/government/publications/spi-m-o-medium-term-projections-and-scenarios-28-october-2020,https://assets.publishing.service.gov.uk/government/uploads/system/uploads/attachment_data/file/949627/S0844_SPI-M-O_MediumTermProjections.pdf
SAGE Supporting papers explaining SPI-M modelling,,SPI-M-O,"SPI-M-O: COVID-19: Medium-term projections explainer, 31 October 2020",SPI-M-O: Medium-term projections explainer - 31 October 2020,2020-11-27,https://www.gov.uk/government/publications/spi-m-o-covid-19-medium-term-projections-explainer-31-october-2020,https://assets.publishing.service.gov.uk/government/uploads/system/uploads/attachment_data/file/938965/201031_SPI-M-O_medium_term_projections_explainer.pdf
SAGE Supporting papers explaining SPI-M modelling,,SPI-M-O,"SPI-M-O: COVID-19: Preparatory analysis long term scenarios, 31 October 2020",SPI-M-O: Preparatory analysis long term scenarios - 31 October 2020,2020-11-27,https://www.gov.uk/government/publications/spi-m-o-covid-19-preparatory-analysis-long-term-scenarios-31-october-2020,https://assets.publishing.service.gov.uk/government/uploads/system/uploads/attachment_data/file/938967/201031_SPI-M_preparatory_analysis_long_term_scenarios.pdf
SAGE 65,2020-11-04,SAGE Minutes,"SAGE 65 minutes: Coronavirus (COVID-19) response, 4 November 2020",Sixty-fifth SAGE meeting on COVID-19 - 4 November 2020,2020-11-13,https://www.gov.uk/government/publications/sage-65-minutes-coronavirus-covid-19-response-4-november-2020,https://assets.publishing.service.gov.uk/government/uploads/system/uploads/attachment_data/file/935102/sage-65-meeting-covid-19-s0863.pdf
SAGE 65,2020-11-04,TFC,"TFC: Children and transmission, 4 November 2020","TFC: Update on children, schools and transmission - 4 November 2020",2020-11-13,https://www.gov.uk/government/publications/tfc-children-and-transmission-4-november-2020,https://assets.publishing.service.gov.uk/government/uploads/system/uploads/attachment_data/file/935125/tfc-covid-19-children-transmission-s0860-041120.pdf
SAGE 65,2020-11-04,SPI-B/DfE,"SPI-B/DfE: COVID-19: Benefits of remaining in education - evidence and considerations, 4 November 2020","Benefits of remaining in education - evidence and considerations, 4 November 2020",2020-11-13,https://www.gov.uk/government/publications/spi-bdfe-covid-19-benefits-of-remaining-in-education-evidence-and-considerations-4-november-2020,https://assets.publishing.service.gov.uk/government/uploads/system/uploads/attachment_data/file/935192/spi-b-dfe-benefits-remaining-education-s0861-041120.pdf
SAGE 66,2020-11-05,SAGE Minutes,"SAGE 66 minutes: Coronavirus (COVID-19) response, 5 November 2020",Sixty-sixth SAGE Meeting on COVID-19 - 5 November 2020,2020-11-27,https://www.gov.uk/government/publications/sage-66-minutes-coronavirus-covid-19-response-5-november-2020,https://assets.publishing.service.gov.uk/government/uploads/system/uploads/attachment_data/file/938974/S0868_Sixty-sixth_SAGE_meeting_on_Covid-19.pdf
SAGE 66,2020-11-05,Dynamic CO-CIN report,"Dynamic CO-CIN report to SAGE and NERVTAG (all cases), 5 November 2020",Dynamic CO-CIN report to SAGE and NERVTAG (all cases) - 5 November 2020,2020-11-20,https://www.gov.uk/government/publications/dynamic-co-cin-report-to-sage-and-nervtag-all-cases-5-november-2020,https://assets.publishing.service.gov.uk/government/uploads/system/uploads/attachment_data/file/936891/S0870_Dynamic_CO-CIN_report_to_SAGE_and_NERVTAG__All_Cases_.pdf
SAGE 66,2020-11-05,Dynamic CO-CIN report,"Dynamic CO-CIN report to SAGE and NERVTAG (recent cases), 5 November 2020",Dynamic CO-CIN report to SAGE and NERVTAG (recent cases) - 5 November 2020,2020-11-20,https://www.gov.uk/government/publications/dynamic-co-cin-report-to-sage-and-nervtag-recent-cases-5-november-2020,https://assets.publishing.service.gov.uk/government/uploads/system/uploads/attachment_data/file/936884/S0869_Dynamic_CO-CIN_Report_to_SAGE_and_NERVTAG__Recent_Cases_.pdf
SAGE 66,2020-11-05,EMG,"EMG: Potential application of air cleaning devices and personal decontamination to manage transmission of COVID-19, 4 November 2020",Potential application of air cleaning devices and personal decontamination to manage transmission of COVID-19 - 4 November 2020,2020-11-20,https://www.gov.uk/government/publications/emg-potential-application-of-air-cleaning-devices-and-personal-decontamination-to-manage-transmission-of-covid-19-4-november-2020,https://assets.publishing.service.gov.uk/government/uploads/system/uploads/attachment_data/file/939173/S0867_EMG_Potential_application_of_air_cleaning_devices_and_personal_decontamination_to_manage_transmission_of_COVID-19.pdf
SAGE 66,2020-11-05,Celebrations and Observances Task and Finish Group,"Key evidence and advice on celebrations and observances during COVID-19, 5 November 2020",Key evidence and advice on celebrations and observances during COVID-19 - 5 November 2020,2020-11-27,https://www.gov.uk/government/publications/spi-b-key-evidence-and-advice-on-celebrations-and-observances-during-covid-19-5-november-2020,https://assets.publishing.service.gov.uk/government/uploads/system/uploads/attachment_data/file/939166/S0866_Key_Evidence_and_Advice_on_Celebrations_and_Observances_during_COVID-19.pdf
SAGE 66,2020-11-05,SPI-M-O,"SPI-M-O: Consensus statement on COVID-19, 4 November 2020",SPI-M-O: Consensus statement on COVID-19 - 4 November 2020,,https://www.gov.uk/government/publications/spi-m-o-consensus-statement-on-covid-19-4-november-2020,https://assets.publishing.service.gov.uk/government/uploads/system/uploads/attachment_data/file/935132/spi-m-o-consensus-statement-covid-19-sage-66-051120-s0864.pdf
SAGE 67,2020-11-12,SAGE Minutes,"SAGE 67 minutes: Coronavirus (COVID-19) response, 12 November 2020",Sixty-seventh SAGE meeting on COVID-19 - 12 November 2020,2020-11-23,https://www.gov.uk/government/publications/sage-67-minutes-coronavirus-covid-19-response-12-november-2020,https://assets.publishing.service.gov.uk/government/uploads/system/uploads/attachment_data/file/937450/S0881_Sixty-seventh_SAGE_meeting_on_Covid-19.pdf
SAGE 67,2020-11-12,SPI-M-O,"SPI-M-O: Consensus statement on COVID-19, 11 November 2020",SPI-M-O: Consensus statement on COVID-19 - 11 November 2020,2020-11-23,https://www.gov.uk/government/publications/spi-m-o-consensus-statement-on-covid-19-11-november-2020,https://assets.publishing.service.gov.uk/government/uploads/system/uploads/attachment_data/file/937444/S0877_SAGE67_201111_SPI-M-O_Consensus_Statement.pdf
SAGE 67,2020-11-12,SPI-M-O,"SPI-M-O: Statement on tiers in England and other measures in the devolved nations, 11 November 2020",SPI-M-O: Statement on tiers in England and other measures in the devolved nations - 11 November 2020,2020-11-23,https://www.gov.uk/government/publications/spi-m-o-statement-on-tiers-in-england-and-other-measures-in-the-devolved-nations-11-november-2020,https://assets.publishing.service.gov.uk/government/uploads/system/uploads/attachment_data/file/937449/S0879_SAGE67_201111_SPI-M-O_Statement_Impact_of_Tier_system_and_other_measures_in_the_UK.pdf
SAGE 67,2020-11-12,NERVTAG,"NERVTAG: Risk assessment of SARS-CoV-2 variants that have been selected in mink, 12 November 2020",Risk assessment of SARS-CoV-2 variants that have been selected in mink - 12 November 2020,2020-11-27,https://www.gov.uk/government/publications/nervtag-risk-assessment-of-sars-cov-2-variants-that-have-been-selected-in-mink-12-november-2020,https://assets.publishing.service.gov.uk/government/uploads/system/uploads/attachment_data/file/938979/S0878_Risk_assessment_of_SARS-CoV-2_variants_that_have_been_selected_in_mink.pdf
SAGE 67,2020-11-12,Dynamic CO-CIN report,"Dynamic CO-CIN report to SAGE and NERVTAG (all cases), 12 November 2020",Dynamic CO-CIN report to SAGE and NERVTAG (all cases) - 12 November 2020,2020-11-27,https://www.gov.uk/government/publications/dynamic-co-cin-report-to-sage-and-nervtag-all-cases-12-november-2020,https://assets.publishing.service.gov.uk/government/uploads/system/uploads/attachment_data/file/938978/S0889_Dynamic_CO-CIN_report_to_SAGE_and_NERVTAG__All_cases_.pdf
SAGE 67,2020-11-12,Dynamic CO-CIN report,"Dynamic CO-CIN report to SAGE and NERVTAG (recent cases), 12 November 2020",Dynamic CO-CIN report to SAGE and NERVTAG (recent cases) - 12 November 2020,2020-11-27,https://www.gov.uk/government/publications/dynamic-co-cin-report-to-sage-and-nervtag-recent-cases-12-november-2020,https://assets.publishing.service.gov.uk/government/uploads/system/uploads/attachment_data/file/938980/S0888_Dynamic_CO-CIN_report_to_SAGE_and_NERVTAG__Recent_cases_.pdf
SAGE 68,2020-11-16,SAGE Minutes,"SAGE 68 minutes: Coronavirus (COVID-19) response, 16 November 2020",Sixty-eighth SAGE meeting on COVID-19 - 16 November 2020,2020-12-18,https://www.gov.uk/government/publications/sage-68-minutes-coronavirus-covid-19-response-16-november-2020,https://assets.publishing.service.gov.uk/government/uploads/system/uploads/attachment_data/file/945960/S0898_Covid-19_SAGE__68_minutes_16112020_redacted.pdf
SAGE 68,2020-11-16,Dynamic CO-CIN report,"Dynamic CO-CIN report to SAGE and NERVTAG (all cases), 16 November 2020",Dynamic CO-CIN report to SAGE and NERVTAG (all cases) - 16 November 2020,2020-11-27,https://www.gov.uk/government/publications/dynamic-co-cin-report-to-sage-and-nervtag-all-cases-16-november-2020,https://assets.publishing.service.gov.uk/government/uploads/system/uploads/attachment_data/file/938975/S0903_Dynamic_CO-CIN_report_to_SAGE_and_NERVTAG__All_cases_.pdf
SAGE 68,2020-11-16,Dynamic CO-CIN report,"Dynamic CO-CIN report to SAGE and NERVTAG (recent cases), 16 November 2020",Dynamic CO-CIN report to SAGE and NERVTAG (recent cases) - 16 November 2020,2020-11-27,https://www.gov.uk/government/publications/dynamic-co-cin-report-to-sage-and-nervtag-recent-cases-16-november-2020,https://assets.publishing.service.gov.uk/government/uploads/system/uploads/attachment_data/file/938976/S0902_Dynamic_CO-CIN_report_to_SAGE_and_NERVTAG__Recent_cases_.pdf
SAGE 68,2020-11-16,SPI-B,"SPI-B: Testing for initiation of quarantine in contacts, 15 November 2020",SPI-B: Testing for initiation of quarantine in contacts -16 November 2020,2020-12-18,https://www.gov.uk/government/publications/spi-b-testing-for-initiation-of-quarantine-in-contacts-15-november-2020,https://assets.publishing.service.gov.uk/government/uploads/system/uploads/attachment_data/file/945767/S0896_2b._2020.11.15_SPI-B_WG_-_Testing_for_initiation_of_quarantine_in_contacts__1_.pdf
SAGE 68,2020-11-16,CMMID COVID-19 working group,"Rapid testing strategies for traced contacts: comparing quarantine, quarantine and testing, and daily testing, 16 November 2020","Rapid testing strategies for traced contacts: comparing quarantine, quarantine and testing, and daily testing - 16 November 2020",2021-01-08,https://www.gov.uk/government/publications/rapid-testing-strategies-for-traced-contacts-comparing-quarantine-quarantine-and-testing-and-daily-testing-16-november-2020,https://assets.publishing.service.gov.uk/government/uploads/system/uploads/attachment_data/file/950689/s0895-test-release-vs-repeat-daily-testing-in-contact-tracing.pdf
SAGE 68,2020-11-16,LSHTM and the University of Manchester,"LSHTM and the University of Manchester: On the use of lateral flow antigen tests in contact tracing - preliminary findings, 15 November 2020",On the use of LFA tests in contact tracing: preliminary findings - 15 November 2020,2021-01-08,https://www.gov.uk/government/publications/tti-modelling-group-on-the-use-of-lateral-flow-antigen-tests-in-contact-tracing-preliminary-findings-15-november-2020,https://assets.publishing.service.gov.uk/government/uploads/system/uploads/attachment_data/file/950771/s0897-testing-of-traced-contacts.pdf
SAGE 69,2020-11-19,SAGE Minutes,"SAGE 69 minutes: Coronavirus (COVID-19) response, 19 November 2020",Sixty-ninth SAGE meeting on COVID-19 - 19 November 2020,2020-11-27,https://www.gov.uk/government/publications/sage-69-minutes-coronavirus-covid-19-response-19-november-2020,https://assets.publishing.service.gov.uk/government/uploads/system/uploads/attachment_data/file/938977/S0909_Sixty-ninth_SAGE_meeting_on_Covid-19.pdf
SAGE 69,2020-11-19,Impact of Interventions TFG,"Impact of Interventions TFG: The UK’s 4 nations’ autumn interventions, 19 November 2020",The UK’s 4 nations’ autumn interventions - 19 November 2020,2020-11-27,https://www.gov.uk/government/publications/impact-of-interventions-tfg-the-uks-4-nations-autumn-interventions-19-november-2020,https://assets.publishing.service.gov.uk/government/uploads/system/uploads/attachment_data/file/939057/S0905_191120_O_Four_Nations__Autumn_Interventions__V1_.pdf
SAGE 69,2020-11-19,SPI-M-O,"SPI-M-O: COVID-19: Notes on the festive period, 19 November 2020",SPI-M-O: Notes on festive period - 19 November 2020,2020-11-27,https://www.gov.uk/government/publications/spi-m-o-covid-19-notes-on-the-festive-period-19-november-2020,https://assets.publishing.service.gov.uk/government/uploads/system/uploads/attachment_data/file/939074/S0911_SAGE69_201115_SPI-M-O_-_Notes_on_Festive_Period.pdf
SAGE 69,2020-11-19,SPI-M-O,"SPI-M-O: Consensus statement on COVID-19, 18 November 2020",SPI-M-O: Consensus statement on COVID-19 - 18 November 2020,2020-11-27,https://www.gov.uk/government/publications/spi-m-o-consensus-statement-on-covid-19-18-november-2020,https://assets.publishing.service.gov.uk/government/uploads/system/uploads/attachment_data/file/939078/S0904_SAGE69_201118_SPI-M-O_Consensus_Statement.pdf
SAGE 69,2020-11-19,Dynamic CO-CIN report,"Dynamic CO-CIN report to SAGE and NERVTAG (all cases), 19 November 2020",Dynamic CO-CIN report to SAGE and NERVTAG (all cases) - 19 November 2020,2020-12-04,https://www.gov.uk/government/publications/dynamic-co-cin-report-to-sage-and-nervtag-all-cases-19-november-2020,https://assets.publishing.service.gov.uk/government/uploads/system/uploads/attachment_data/file/940932/S0913_Dynamic_CO-CIN_report_to_SAGE_and_NERVTAG_all_cases.pdf
SAGE 69,2020-11-19,Dynamic CO-CIN report,"Dynamic CO-CIN report to SAGE and NERVTAG (recent cases), 19 November 2020",Dynamic CO-CIN report to SAGE and NERVTAG (recent cases) - 19 November 2020,2020-12-04,https://www.gov.uk/government/publications/dynamic-co-cin-report-to-sage-and-nervtag-recent-cases-19-november-2020,https://assets.publishing.service.gov.uk/government/uploads/system/uploads/attachment_data/file/940906/S0912_Dynamic_CO-CIN_report_to_SAGE_and_NERVTAG_recent_cases.pdf
SAGE 69,2020-11-19,NERVTAG,"NERVTAG: Certifying COVID-19 immunity, 19 November 2020",Certifying COVID-19 immunity - 19 November 2020,2020-12-04,https://www.gov.uk/government/publications/nervtag-certifying-covid-19-immunity-19-november-2020,https://assets.publishing.service.gov.uk/government/uploads/system/uploads/attachment_data/file/940896/S907_NERVTAG_certifying_COVID_immunity.pdf
