Meeting,Meeting Date,Origin,Index Title,Title,Published,Page URL,PDF URL
SAGE 83,2021-03-11,SPI-B,"SPI-B: Behavioural considerations for vaccine uptake in Phase 2 and beyond, 9 March 2021","SPI-B: Behavioural considerations for vaccine uptake in Phase 2 and beyond, 9 March 2021",2021-05-07,https://www.gov.uk/government/publications/spi-b-behavioural-considerations-for-vaccine-uptake-in-phase-2-and-beyond-9-march-2021,https://assets.publishing.service.gov.uk/government/uploads/system/uploads/attachment_data/file/984351/S1162_SPI-B_-_Behavioural_Considerations_for_Vaccine_Uptake_in_Phase_2.pdf
SAGE 87,2021-04-22,JUNIPER and LSHTM,"JUNIPER and LSHTM: The population attributable fraction (PAF) of cases due to gatherings with relevance to COVID-19 mitigation strategies, 22 April 2021","JUNIPER and LSHTM: The Population Attributable Fraction (PAF) of cases due to gatherings and groups with relevance to COVID-19 mitigation strategies, 22 April 2021",2021-05-07,https://www.gov.uk/government/publications/juniper-and-lshtm-the-population-attributable-fraction-paf-of-cases-due-to-gatherings-with-relevance-to-covid-19-mitigation-strategies-22-april-20,https://assets.publishing.service.gov.uk/government/uploads/system/uploads/attachment_data/file/984100/S1214_SPI-M_The_Population_Attributable_Fraction__PAF__of_cases_due_to_gatherings_and_groups_with_relevance_to_COVID-19_mitigation_strategies.pdf
SAGE 87,2021-04-22,Cross organisation study,"Cross organisation study: Risk factors associated with places of enduring prevalence and potential approaches to monitor changes in this local prevalence, 22 April 2021","Cross organisation study: Risk factors associated with places of enduring prevalence and potential approaches to monitor changes in this local prevalence, 22 April 2021",2021-05-07,https://www.gov.uk/government/publications/cross-organisation-study-risk-factors-associated-with-places-of-enduring-prevalence-and-potential-approaches-to-monitor-changes-in-this-local-prevale,https://assets.publishing.service.gov.uk/government/uploads/system/uploads/attachment_data/file/983665/S1212_Places_of_enduring_prevalence.pdf
SAGE 87,2021-04-22,SPI-M-O,"SPI-M-O: Consensus statement on COVID-19, 21 April 2021","SPI-M-O: Consensus statement on COVID-19, 21 April 2021",2021-05-07,https://www.gov.uk/government/publications/spi-m-o-consensus-statement-on-covid-19-21-april-2021,https://assets.publishing.service.gov.uk/government/uploads/system/uploads/attachment_data/file/984091/S1205_SPI-M-O_Consensus_Statement.pdf
SAGE 87,2021-04-22,SPI-M-O,"SPI-M-O: Medium-term projections, 21 April 2021","SPI-M-O: Medium-Term Projections, 21 April 2021",2021-05-07,https://www.gov.uk/government/publications/spi-m-o-medium-term-projections-21-april-2021,https://assets.publishing.service.gov.uk/government/uploads/system/uploads/attachment_data/file/984019/S1206_SPI-M-O_MediumTermProjections.pdf
SAGE 87,2021-04-22,SPI-M spatial variation subgroup,"SPI-M spatial variation subgroup: Defining 'enduring prevalence', 21 April 2021","SPI-M spatial variation subgroup: Defining 'enduring prevalence', 21 April 2021",2021-05-07,https://www.gov.uk/government/publications/spi-m-spatial-variation-subgroup-defining-enduring-prevalence-21-april-2021,https://assets.publishing.service.gov.uk/government/uploads/system/uploads/attachment_data/file/984083/S1213_Defining_enduring_prevalence.pdf
SAGE 79,2021-02-04,Welsh Government TAG,"Welsh Government TAG: 'Long-COVID' - what do we know and what do we need to know?, 1 February 2021",Welsh Government TAG: 'Long-COVID' - what do we know and what do we need to know?  1 February 2021,,https://www.gov.uk/government/publications/welsh-government-tag-long-covid-what-do-we-know-and-what-do-we-need-to-know-1-february-2021,https://gov.wales/sites/default/files/publications/2021-03/technical-advisory-group-long-covid-what-do-we-know-and-what-do-we-need-to-know.pdf
SAGE 83,2021-03-11,PHE,"PHE: Factors contributing to the transmission of COVID-19 within food manufacturing and processing settings - a rapid review, 5 March 2021","PHE: Factors contributing to the transmission of COVID-19 within food manufacturing and processing settings - a rapid review, 5 March 2021",2021-05-28,https://www.gov.uk/government/publications/phe-factors-contributing-to-the-transmission-of-covid-19-within-food-manufacturing-and-processing-settings-a-rapid-review-5-march-2021,https://phe.koha-ptfs.co.uk/cgi-bin/koha/opac-retrieve-file.pl?id=e985277d5b8cffe321f68c145174c013
SAGE 88,2021-05-05,SAGE Minutes,"SAGE 88 minutes: Coronavirus (COVID-19) response, 5 May 2021","SAGE 88 minutes: Coronavirus (COVID-19) response, 5 May 2021",2021-05-10,https://www.gov.uk/government/publications/sage-88-minutes-coronavirus-covid-19-response-5-may-2021,https://assets.publishing.service.gov.uk/government/uploads/system/uploads/attachment_data/file/984501/S1235_Eighty-eighth_SAGE_meeting.pdf
SAGE 88,2021-05-05,SPI-M-O,"SPI-M-O: Summary of further modelling of easing restrictions - roadmap step 3, 5 May 2021","SPI-M-O: Summary of further modelling of easing restrictions - roadmap step 3, 5 May 2021",2021-05-10,https://www.gov.uk/government/publications/spi-m-o-summary-of-further-modelling-of-easing-restrictions-roadmap-step-3-5-may-2021,https://assets.publishing.service.gov.uk/government/uploads/system/uploads/attachment_data/file/984521/S1227_SPI-M-O_Summary_of_further_modelling_of_easing_restrictions_Roadmap_Step_3__2_.pdf
SAGE 88,2021-05-05,Imperial College London,"Imperial College London: Evaluating the roadmap out of lockdown - step 3, 5 May 2021","Imperial College London: Evaluating the Roadmap out of Lockdown: Step 3, 5 May 2021",2021-05-10,https://www.gov.uk/government/publications/imperial-college-london-evaluating-the-roadmap-out-of-lockdown-step-3-5-may-2021,https://assets.publishing.service.gov.uk/government/uploads/system/uploads/attachment_data/file/984688/S1228_Imperial_Evaluating_the_Roadmap_out_of_Lockdown_Step_3.pdf
SAGE 88,2021-05-05,University of Warwick,"University of Warwick: Roadmap scenarios and sensitivity - steps 3 and 4, 5 May 2021","University of Warwick: Roadmap scenarios and sensitivity - steps 3 and 4, 5 May 2021",2021-05-10,https://www.gov.uk/government/publications/university-of-warwick-roadmap-scenarios-and-sensitivity-steps-3-and-4-5-may-2021,https://assets.publishing.service.gov.uk/government/uploads/system/uploads/attachment_data/file/984533/S1229_Warwick_Road_Map_Scenarios_and_Sensitivity_Steps_3_and_4.pdf
SAGE 88,2021-05-05,LSHTM,"LSHTM: Interim roadmap assessment - prior to steps 3 and 4, 5 May 2021","LSHTM: Interim roadmap assessment: prior to steps 3 and 4, 5 May 2021",2021-05-10,https://www.gov.uk/government/publications/lshtm-interim-roadmap-assessment-prior-to-steps-3-and-4-5-may-2021,https://assets.publishing.service.gov.uk/government/uploads/system/uploads/attachment_data/file/984546/S1230_LSHTM_Interim_roadmap_assessment_prior_to_steps_3_and_4.pdf
SAGE 88,2021-05-05,Dynamic CO-CIN report,"Dynamic CO-CIN report to SAGE and NERVTAG, 5 May 2021","Dynamic CO-CIN report to SAGE and NERVTAG, 5 May 2021",2021-05-14,https://www.gov.uk/government/publications/dynamic-co-cin-report-to-sage-and-nervtag-5-may-2021,https://assets.publishing.service.gov.uk/government/uploads/system/uploads/attachment_data/file/985652/S1231_CO-CIN_Dynamic_Report_2nd_Wave.pdf
SAGE 88,2021-05-05,SPI-M-O,"SPI-M-O: Consensus statement on COVID-19, 5 May 2021","SPI-M-O: Consensus statement on COVID-19, 5 May 2021",2021-05-21,https://www.gov.uk/government/publications/spi-m-o-consensus-statement-on-covid-19-5-may-2021,https://assets.publishing.service.gov.uk/government/uploads/system/uploads/attachment_data/file/988227/S1224_SPI-M-O_Consensus_Statement__1_.pdf
SAGE 88,2021-05-05,SPI-M-O,"SPI-M-O: Medium-term projections, 5 May 2021","SPI-M-O: Medium-term projections, 5 May 2021",2021-05-21,https://www.gov.uk/government/publications/spi-m-o-medium-term-projections-5-may-2021,https://assets.publishing.service.gov.uk/government/uploads/system/uploads/attachment_data/file/988229/S1225_SPI-M-O_MediumTermProjections__1_.pdf
SAGE 88,2021-05-05,Vaccines Update Group,"Vaccines Update Group: Setting up medium-and long-term vaccine strain selection and immunity management for SARS-CoV-2, 4 May 2021","Vaccines Update Group: Setting up medium-and long-term vaccine strain selection and immunity management for SARS-CoV-2, 4 May 2021",2021-05-21,https://www.gov.uk/government/publications/vaccines-update-group-setting-up-medium-and-long-term-vaccine-strain-selection-and-immunity-management-for-sars-cov-2-4-may-2021,https://assets.publishing.service.gov.uk/government/uploads/system/uploads/attachment_data/file/988226/S1226_Setting_up_medium-_and_long-term_vaccine_strain_selection_and_immunity_management_for_SARS-CoV-2__1_.pdf
SAGE 89,2021-05-13,SAGE Minutes,"SAGE 89 minutes: Coronavirus (COVID-19) response, 13 May 2021","SAGE 89 minutes: Coronavirus (COVID-19) response, 13 May 2021",2021-05-14,https://www.gov.uk/government/publications/sage-89-minutes-coronavirus-covid-19-response-13-may-2021,https://assets.publishing.service.gov.uk/government/uploads/system/uploads/attachment_data/file/988403/S1236_Eighty-nineth_SAGE.pdf
SAGE 89,2021-05-13,SPI-M-O,"SPI-M-O: Consensus statement on COVID-19, 12 May 2021","SPI-M-O: Consensus statement on COVID-19, 12 May 2021",2021-05-14,https://www.gov.uk/government/publications/spi-m-o-consensus-statement-on-covid-19-12-may-2021,https://assets.publishing.service.gov.uk/government/uploads/system/uploads/attachment_data/file/986709/S1237_SPI-M-O_Consensus_Statement.pdf
SAGE 89,2021-05-13,Dynamic CO-CIN report,"Dynamic CO-CIN report to SAGE and NERVTAG, 13 May 2021","Dynamic CO-CIN report to SAGE and NERVTAG, 13 May 2021",2021-05-21,https://www.gov.uk/government/publications/dynamic-co-cin-report-to-sage-and-nervtag-13-may-2021,https://assets.publishing.service.gov.uk/government/uploads/system/uploads/attachment_data/file/988217/S1246_CO-CIN_Dynamic_Report_2nd_Wave.pdf
SAGE 89,2021-05-13,CMMID COVID-19 Working Group,"CMMID COVID-19 Working Group: Modelling importations and local transmission of B.1.617.2 in the UK, 12 May 2021","CMMID COVID-19 Working Group: Modelling importations and local transmission of B.1.617.2 in the UK, 12 May 2021",2021-05-21,https://www.gov.uk/government/publications/cmmid-covid-19-working-group-modelling-importations-and-local-transmission-of-b16172-in-the-uk-12-may-2021,https://assets.publishing.service.gov.uk/government/uploads/system/uploads/attachment_data/file/988203/S1240_CMMID_COVID-19_Working_Group_Modelling_importations_and_local_transmission_of_B.1.617.2_in_the_UK__13_May_2021.pdf
SAGE 89,2021-05-13,JUNIPER,"JUNIPER: Potential community transmission of B.1.617.2 inferred by S-gene positivity - briefing note, 11 May 2021","JUNIPER: Potential community transmission of B.1.617.2 inferred by S-gene positivity - briefing note, 11 May 2021",2021-05-21,https://www.gov.uk/government/publications/juniper-potential-community-transmission-of-b16172-inferred-by-s-gene-positivity-briefing-note-11-may-2021,https://assets.publishing.service.gov.uk/government/uploads/system/uploads/attachment_data/file/988205/S1239_Joint_UNIversities_Pandemic_and_Epidemiological_Research.pdf
SAGE 89,2021-05-13,SPI-M-O,"SPI-M-O: Medium-term projections, 12 May 2021","SPI-M-O: Medium-term projections, 12 May 2021",2021-05-28,https://www.gov.uk/government/publications/spi-m-o-medium-term-projections-12-may-2021,https://assets.publishing.service.gov.uk/government/uploads/system/uploads/attachment_data/file/989812/S1238_SPI-M-O_MediumTermProjections.pdf
SAGE 89,2021-05-13,UCL,"UCL: Relative importance of different settings for COVID-19 transmission, 13 May 2021","UCL: Relative importance of different settings for COVID-19 transmission, 13 May 2021",2021-05-28,https://www.gov.uk/government/publications/ucl-relative-importance-of-different-settings-for-covid-19-transmission-13-may-2021,https://assets.publishing.service.gov.uk/government/uploads/system/uploads/attachment_data/file/990149/S1247_Relative_importance_of_different_settings_for_COVID-19_acquisition_paper.pdf
SAGE 80,2021-02-11,UCL,"UCL: Impacts of school closures on physical and mental health of children and young people - a systematic review, 11 February 2021","UCL: Impacts of school closures on physical and mental health of children and young people - a systematic review, 11 February 2021",2021-07-02,https://www.gov.uk/government/publications/ucl-impacts-of-school-closures-on-physical-and-mental-health-of-children-and-young-people-a-systematic-review-11-february-2021,https://assets.publishing.service.gov.uk/government/uploads/system/uploads/attachment_data/file/998894/s1114_school_closure.pdf
SAGE 90,2021-05-27,SAGE Minutes,"SAGE 90 minutes: Coronavirus (COVID-19) response, 27 May 2021","SAGE 90 minutes: Coronavirus (COVID-19) response, 27 May 2021",2021-06-14,https://www.gov.uk/government/publications/sage-90-minutes-coronavirus-covid-19-response-27-may-2021,https://assets.publishing.service.gov.uk/government/uploads/system/uploads/attachment_data/file/993360/S1250_SAGE_90_Minutes_.pdf
SAGE 90,2021-05-27,SPI-M-O,"SPI-M-O: Consensus statement on COVID-19, 26 May 2021","SPI-M-O: Consensus statement on COVID-19, 26 May 2021",2021-06-14,https://www.gov.uk/government/publications/spi-m-o-consensus-statement-on-covid-19-26-may-2021,https://assets.publishing.service.gov.uk/government/uploads/system/uploads/attachment_data/file/993318/S1251_SPI-M-O_Consensus_Statement.pdf
SAGE 90,2021-05-27,LSHTM,"LSHTM: Dynamics of Delta (B.1.617.2) in the UK from importations, traveller-linked and non-traveller linked transmission, 25 May 2021","LSHTM: Dynamics of Delta (B.1.617.2) in the UK from importations, traveller-linked and non-traveller linked transmission, 25 May 2021",2021-06-14,https://www.gov.uk/government/publications/lshtm-dynamics-of-delta-b16172-in-the-uk-from-importations-traveller-linked-and-non-traveller-linked-transmission-25-may-2021,https://assets.publishing.service.gov.uk/government/uploads/system/uploads/attachment_data/file/993104/S1253_Modelling_B.1.617.2_LSHTM.pdf
SAGE 90,2021-05-27,SPI-M-O,"SPI-M-O: Medium-term projections, 26 May 2021","SPI-M-O: Medium-term projections, 26 May 2021",2021-06-11,https://www.gov.uk/government/publications/spi-m-o-medium-term-projections-26-may-2021,https://assets.publishing.service.gov.uk/government/uploads/system/uploads/attachment_data/file/992320/S1252_SPI-M-O_MediumTermProjections.pdf
SAGE 90,2021-05-27,NERVTAG,"NERVTAG: Update note on immunity to SARS-CoV-2 after natural infection, 27 May 2021","NERVTAG: Update note on immunity to SARS-CoV-2 after natural infection, 27 May 2021",2021-06-11,https://www.gov.uk/government/publications/nervtag-update-note-on-immunity-to-sars-cov-2-after-natural-infection-27-may-2021,https://assets.publishing.service.gov.uk/government/uploads/system/uploads/attachment_data/file/992944/S1255_NERVTAG_-_Immunity_following_natural_infection.pdf
SAGE 90,2021-05-27,EMG and SPI-B,"EMG and SPI-B: Application of CO2 monitoring as an approach to managing ventilation to mitigate SARS-CoV-2 transmission, 27 May 2021","EMG and SPI-B: Application of CO2 monitoring as an approach to managing ventilation to mitigate SARS-CoV-2 transmission, 27 May 2021",2021-06-11,https://www.gov.uk/government/publications/emg-and-spi-b-application-of-co2-monitoring-as-an-approach-to-managing-ventilation-to-mitigate-sars-cov-2-transmission-27-may-2021,https://assets.publishing.service.gov.uk/government/uploads/system/uploads/attachment_data/file/992966/S1256_EMG_SPI-B_Application_of_CO2_monitoring_as_an_approach_to_managing_ventilation_to_mitigate_SARS-CoV-2_transmission.pdf
SAGE 90,2021-05-27,Dynamic CO-CIN report,"Dynamic CO-CIN report to SAGE and NERVTAG, 26 May 2021","Dynamic CO-CIN report to SAGE and NERVTAG, 26 May 2021",2021-06-11,https://www.gov.uk/government/publications/dynamic-co-cin-report-to-sage-and-nervtag-26-may-2021,https://assets.publishing.service.gov.uk/government/uploads/system/uploads/attachment_data/file/992956/S1258_CO-CIN_Dynamic_Report_2nd_Wave_update_.pdf
SAGE 90,2021-05-27,SCWG,"SCWG: What are the appropriate mitigations to deploy in care homes in the context of the post vaccination risk landscape?, 26 May 2021","SCWG: What are the appropriate mitigations to deploy in care homes in the context of the post vaccination risk landscape?, 26 May 2021",2021-06-18,https://www.gov.uk/government/publications/scwg-what-are-the-appropriate-mitigations-to-deploy-in-care-homes-in-the-context-of-the-post-vaccination-risk-landscape-26-may-2021,https://assets.publishing.service.gov.uk/government/uploads/system/uploads/attachment_data/file/994620/S1257_SCWG_Post_Vaccination_Mitigations.pdf
SAGE 91,2021-06-03,SAGE Minutes,"SAGE 91 minutes: Coronavirus (COVID-19) response, 3 June 2021","SAGE 91 minutes: Coronavirus (COVID-19) response, 3 June 2021",2021-06-14,https://www.gov.uk/government/publications/sage-91-minutes-coronavirus-covid-19-response-3-june-2021,https://assets.publishing.service.gov.uk/government/uploads/system/uploads/attachment_data/file/993106/S1266_SAGE_91_Minutes.pdf
SAGE 91,2021-06-03,SPI-M-O,"SPI-M-O: Consensus statement on COVID-19, 3 June 2021","SPI-M-O: Consensus statement on COVID-19, 3 June 2021",2021-06-14,https://www.gov.uk/government/publications/spi-m-o-consensus-statement-on-covid-19-3-june-2021,https://assets.publishing.service.gov.uk/government/uploads/system/uploads/attachment_data/file/993321/S1267_SPI-M-O_Consensus_Statement.pdf
SAGE 91,2021-06-03,University of Warwick,"University of Warwick: Estimating the transmission advantage for Delta variant (B.1.617.2), 3 June 2021","University of Warwick: Estimating the Transmission Advantage for B.1.617.2, 3 June 2021",2021-06-14,https://www.gov.uk/government/publications/university-of-warwick-estimating-the-transmission-advantage-for-delta-variant-b16172-3-june-2021,https://assets.publishing.service.gov.uk/government/uploads/system/uploads/attachment_data/file/993156/S1269_WARWICKTransmission_Advantage.pdf
SAGE 91,2021-06-03,JUNIPER,"JUNIPER: Comparing temporal trends in the demographics of S+ and S- COVID cases, 3 June 2021","JUNIPER: Comparing temporal trends in the demographics of S+ and S- COVID cases, 3 June 2021",2021-06-14,https://www.gov.uk/government/publications/juniper-comparing-temporal-trends-in-the-demographics-of-s-and-s-covid-cases-3-june-2021,https://assets.publishing.service.gov.uk/government/uploads/system/uploads/attachment_data/file/993485/S1274_JUNIPER_demographic_trends.pdf
SAGE 91,2021-06-03,JUNIPER,"JUNIPER: Estimates of R advantage at fine spatial scale, 2 June 2021","JUNIPER: Estimates of R advantage at fine spatial scale, 2 June 2021",2021-06-14,https://www.gov.uk/government/publications/juniper-estimates-of-r-advantage-at-fine-spatial-scale-2-june-2021,https://assets.publishing.service.gov.uk/government/uploads/system/uploads/attachment_data/file/993246/S1273_JUNIPER_-_R_advantage.pdf
SAGE 91,2021-06-03,Imperial College London,"Imperial College London: Delta (B.1.617.2) transmission in England - risk factors and transmission advantage, 1 June 2021","Imperial College London: Delta (B.1.617.2) transmission in England - risk factors and transmission advantage, 1 June 2021",2021-06-14,https://www.gov.uk/government/publications/imperial-college-london-delta-b16172-transmission-in-england-risk-factors-and-transmission-advantage-1-june-2021,https://assets.publishing.service.gov.uk/government/uploads/system/uploads/attachment_data/file/993159/S1270_IMPERIAL_B.1.617.2.pdf
SAGE 91,2021-06-03,LSHTM,"LSHTM:  Local area reproduction numbers and S gene positivity, 1 June 2021","LSHTM:  Local area reproduction numbers and S gene positivity, 1 June 2021",2021-06-14,https://www.gov.uk/government/publications/lshtm-local-area-reproduction-numbers-and-s-gene-positivity-1-june-2021,https://assets.publishing.service.gov.uk/government/uploads/system/uploads/attachment_data/file/993228/S1271_Local_area_reproduction_numbers_and_S-gene_positivity.pdf
SAGE 91,2021-06-03,LSHTM,"LSHTM: Dynamics of Delta (B.1.617.2) in England NHS regions from importations, traveller-linked and non-traveller linked transmission, 1 June 2021","LSHTM: Dynamics of Delta (B.1.617.2) in England NHS regions from importations, traveller-linked and non-traveller linked transmission, 1 June 2021",2021-06-14,https://www.gov.uk/government/publications/lshtm-dynamics-of-delta-b16172-in-england-nhs-regions-from-importations-traveller-linked-and-non-traveller-linked-transmission-1-june-2021,https://assets.publishing.service.gov.uk/government/uploads/system/uploads/attachment_data/file/993232/S1272_LSHTM_Modelling_Paper_B.1.617.2.pdf
SAGE 91,2021-06-03,SPI-M-O,"SPI-M-O: Medium-term projections, 2 June 2021","SPI-M-O: Medium-term projections, 2 June 2021",2021-06-18,https://www.gov.uk/government/publications/spi-m-o-medium-term-projections-2-june-2021,https://assets.publishing.service.gov.uk/government/uploads/system/uploads/attachment_data/file/994670/S1268_SPI-M-O_MediumTermProjections.pdf
SAGE 91,2021-06-03,Dynamic CO-CIN report,"Dynamic CO-CIN report to SAGE and NERVTAG, 3 June 2021","Dynamic CO-CIN report to SAGE and NERVTAG, 3 June 2021",2021-06-18,https://www.gov.uk/government/publications/dynamic-co-cin-report-to-sage-and-nervtag-3-june-2021,https://assets.publishing.service.gov.uk/government/uploads/system/uploads/attachment_data/file/994728/S1275_CO-CIN_Dynamic_Report.pdf
SAGE 91,2021-06-03,PHS and EAVE II,"PHS and EAVE II: Demographics, hospital outcomes and vaccine effect of S gene positive cases in Scotland from 1 April 2020, 3 June 2021","PHS and EAVE II: Demographics, hospital outcomes and vaccine effect of S gene positive cases in Scotland from 1 April 2020, 3 June 2021",2021-06-25,https://www.gov.uk/government/publications/phs-and-eave-ii-demographics-hospital-outcomes-and-vaccine-effect-of-s-gene-positive-cases-in-scotland-from-april-01-2020-3-june-2021,https://assets.publishing.service.gov.uk/government/uploads/system/uploads/attachment_data/file/996684/S1278_PHS_Strathclyde_SGene_Pos.pdf
SAGE 91,2021-06-03,LSHTM and KCL,"LSHTM and KCL: Reconstructing the secondary case distribution of SARS-CoV-2 from heterogeneity in viral load trajectories and social contacts, 1 June 2021","LSHTM and KCL: Reconstructing the secondary case distribution of SARS-CoV-2 from heterogeneity in viral load trajectories and social contacts, 1 June 2021",2021-07-02,https://www.gov.uk/government/publications/lshtm-and-kcl-reconstructing-the-secondary-case-distribution-of-sars-cov-2-from-heterogeneity-in-viral-load-trajectories-and-social-contacts-1-june,https://assets.publishing.service.gov.uk/government/uploads/system/uploads/attachment_data/file/998423/S1282_Comix_Reconstructing_the_secondary_case_distribution_of_SARS-CoV-2_from_heterogeneity_in_viral_load_trajectories_and_social_contacts.pdf
SAGE 92,2021-06-09,SAGE Minutes,"SAGE 92 minutes: Coronavirus (COVID-19) response, 9 June 2021","SAGE 92 minutes: Coronavirus (COVID-19) response, 9 June 2021",2021-06-14,https://www.gov.uk/government/publications/sage-92-minutes-coronavirus-covid-19-response-9-june-2021,https://assets.publishing.service.gov.uk/government/uploads/system/uploads/attachment_data/file/993387/S1284_SAGE_92_minutes.pdf
SAGE 92,2021-06-09,SPI-M-O,"SPI-M-O: Consensus statement on COVID-19, 9 June 2021","SPI-M-O: Consensus statement on COVID-19, 9 June 2021",2021-06-14,https://www.gov.uk/government/publications/spi-m-o-consensus-statement-on-covid-19-9-june-2021,https://assets.publishing.service.gov.uk/government/uploads/system/uploads/attachment_data/file/993339/S1285_SPI-M-O_Consensus_Statement.pdf
SAGE 92,2021-06-09,SPI-M-O,"SPI-M-O: Summary of further modelling of easing restrictions - roadmap Step 4, 9 June 2021",SPI-M-O: Summary of further modelling of easing restrictions - roadmap Step 4,2021-06-14,https://www.gov.uk/government/publications/spi-m-o-summary-of-further-modelling-of-easing-restrictions-roadmap-step-4-9-june-2021,https://assets.publishing.service.gov.uk/government/uploads/system/uploads/attachment_data/file/993510/S1287_SPI-M-O_Summary_Roadmap_step_4.pdf
SAGE 92,2021-06-09,University of Warwick,"University of Warwick: Road map scenarios and sensitivity - Step 4, 9 June 2021","Warwick: Road map scenarios and sensitivity - Step 4, 9 June 2021",2021-06-14,https://www.gov.uk/government/publications/university-of-warwick-road-map-scenarios-and-sensitivity-step-4-9-june-2021,https://assets.publishing.service.gov.uk/government/uploads/system/uploads/attachment_data/file/993358/s1288_Warwick_RoadMap_Step_4.pdf
SAGE 92,2021-06-09,LSHTM,"LSHTM: Interim roadmap assessment - prior to Step 4, 9 June 2021","LSHTM: Interim roadmap assessment - prior to Step 4, 9 June 2021",2021-06-14,https://www.gov.uk/government/publications/lshtm-interim-roadmap-assessment-prior-to-step-4-9-june-2021,https://assets.publishing.service.gov.uk/government/uploads/system/uploads/attachment_data/file/993361/S1290_LSHTM_Roadmap_Step_4.pdf
SAGE 92,2021-06-09,Imperial College London,"Imperial College London: Evaluating the roadmap out of lockdown - modelling Step 4 of the roadmap in the context of B.1.617.2 (Delta), 9 June 2021","Imperial College London: Evaluating the Roadmap out of Lockdown - modelling Step 4 of the roadmap in the context of B.1.617.2 (Delta), 9 June 2021",2021-06-14,https://www.gov.uk/government/publications/imperial-college-london-evaluating-the-roadmap-out-of-lockdown-modelling-step-4-of-the-roadmap-in-the-context-of-b16172-delta-9-june-2021,https://assets.publishing.service.gov.uk/government/uploads/system/uploads/attachment_data/file/993427/S1289_Imperial_Roadmap_Step_4.pdf
