Meeting,Meeting Date,Origin,Index Title,Title,Published,Page URL,PDF URL
SAGE 31,2020-05-01,Netherlands National Institute for Public Health and the Environment (RIVM),"Technical briefing to Dutch Parliament: role of children in the COVID-19 outbreak, 22 April 2020",Technical briefing to Dutch Parliament: role of children in the COVID-19 outbreak - 22 April 2020,2020-05-22,https://www.gov.uk/government/publications/technical-briefing-to-dutch-parliament-role-of-children-in-the-covid-19-outbreak-22-april-2020,https://assets.publishing.service.gov.uk/government/uploads/system/uploads/attachment_data/file/893123/s0291-dutch-parliament-role-of-children-in-transmission-220420-sage31.pdf
SAGE 31,2020-05-01,,"Transmission and susceptibility in children, 1 May 2020",Transmission and susceptibility in children - 1 May 2020,2020-05-22,https://www.gov.uk/government/publications/transmission-and-susceptibility-in-children-1-may-2020,https://assets.publishing.service.gov.uk/government/uploads/system/uploads/attachment_data/file/894617/s0301-susceptibility-transmission-in-children-sage31.pdf
SAGE 31,2020-05-01,TFC,"TFC: Modelling and behavioural science responses to scenarios for relaxing school closures, 1 May 2020",Interdisciplinary Task and Finish Group on the Role of Children in Transmission: Modelling and behavioural science responses to scenarios for relaxing school closures - 1 May 2020,2020-05-22,https://www.gov.uk/government/publications/tfc-modelling-and-behavioural-science-responses-to-scenarios-for-relaxing-school-closures-1-may-2020,https://assets.publishing.service.gov.uk/government/uploads/system/uploads/attachment_data/file/894884/s0300-tfc-modelling-behavioural-science-relaxing-school-closures-sage31.pdf
SAGE 32,2020-05-01,SAGE Minutes,"SAGE 32 minutes: Coronavirus (COVID-19) response, 1 May 2020",Thirty-second SAGE meeting on COVID-19 - 1 May 2020,2020-05-29,https://www.gov.uk/government/publications/sage-minutes-coronavirus-covid-19-response-1-may-2020--2,https://assets.publishing.service.gov.uk/government/uploads/system/uploads/attachment_data/file/940942/S0402_Thirty_second_SAGE_meeting_on_COVID-19.pdf
SAGE 32,2020-05-01,LSHTM,"Estimated impact of testing quarantined contacts at different points in time, 30 April 2020",Estimated impact of testing quarantined contacts at different points in time - 30 April 2020,2020-06-19,https://www.gov.uk/government/publications/estimated-impact-of-testing-quarantined-contacts-at-different-points-in-time-30-april-2020,https://assets.publishing.service.gov.uk/government/uploads/system/uploads/attachment_data/file/893655/S0278_LSHTM_quarantine_test_contacts_updated.pdf
SAGE 32,2020-05-01,LSHTM,"Estimated impact of delay from isolation of symptomatic case to test result and quarantine of contacts, 26 April 2020",Estimated impact of delay from isolation of symptomatic case to test result and quarantine of contacts - 26 April 2020,2020-06-19,https://www.gov.uk/government/publications/estimated-impact-of-delay-from-isolation-of-symptomatic-case-to-test-result-and-quarantine-of-contacts-26-april-2020,https://assets.publishing.service.gov.uk/government/uploads/system/uploads/attachment_data/file/893653/S0277_LSHTM_quarantine_delay.pdf
SAGE 33,2020-05-05,SAGE Minutes,"SAGE 33 minutes: Coronavirus (COVID-19) response, 5 May 2020",Thirty-third SAGE meeting on COVID-19 - 5 May 2020,2020-05-29,https://www.gov.uk/government/publications/sage-minutes-coronavirus-covid-19-response-5-may-2020,https://assets.publishing.service.gov.uk/government/uploads/system/uploads/attachment_data/file/888809/S0403_Thirty-third_SAGE_meeting_on_Covid-19_.pdf
SAGE 33,2020-05-05,SPI-M-O,"SPI-M-O: Consensus view on the potential relaxing of social distancing measures, 4 May 2020",SPI-M-O: Consensus view on potential relaxing of social distancing measures - 4 May 2020,2020-05-29,https://www.gov.uk/government/publications/spi-m-o-consensus-view-on-the-potential-relaxing-of-social-distancing-measures-4-may-2020,https://assets.publishing.service.gov.uk/government/uploads/system/uploads/attachment_data/file/888759/S0313_SAGE33_Consensus_for_SPI-M_on_transition_strategies.pdf
SAGE 33,2020-05-05,Dynamic CO-CIN report,"Dynamic CO-CIN report to SAGE and NERVTAG, 4 May 2020","Dynamic CO-CIN report to SAGE and NERVTAG, 4 May 2020",2020-05-20,https://www.gov.uk/government/publications/dynamic-co-cin-report-to-sage-and-nervtag-4-may-2020,https://assets.publishing.service.gov.uk/government/uploads/system/uploads/attachment_data/file/888250/s0317-co-cin-report-040520-sage33.pdf
SAGE 33,2020-05-05,SPI-M-O,"SPI-M-O: Consensus statement on COVID-19, 5 May 2020",SPI-M-O: Consensus statement on COVID-19 - 5 May 2020,2020-07-31,https://www.gov.uk/government/publications/spi-m-o-consensus-statement-on-covid-19-5-may-2020,https://assets.publishing.service.gov.uk/government/uploads/system/uploads/attachment_data/file/904645/S0312_SAGE33_200504_SPI-M-O_Consensus_Statement.pdf
SAGE 33,2020-05-05,SPI-M-O,"SPI-M-O: COVID-19 short-term pilot forecasts, 3 May 2020",SPI-M-O short-term pilot forecasts (S0311) - 3 May 2020,2020-09-11,https://www.gov.uk/government/publications/spi-m-o-covid-19-short-term-pilot-forecasts-3-may-2020,https://assets.publishing.service.gov.uk/government/uploads/system/uploads/attachment_data/file/917031/SAGE33_2b._20200504_forecasts_SAGE_S0311_for_release_v2.pdf
SAGE 33,2020-05-05,SAGE secretariat,"SAGE return for COVID-19 strategy: sequencing of social distancing behavioural and social interventions, 6 May 2020",SAGE return for COVID-19 strategy: sequencing of social distancing BSIs - 6 May 2020,2021-01-29,https://www.gov.uk/government/publications/sage-return-for-covid-19-strategy-sequencing-of-social-distancing-behavioural-and-social-interventions-6-may-2020,https://assets.publishing.service.gov.uk/government/uploads/system/uploads/attachment_data/file/957021/s0310-sage-return-easing-social-distancing-measures.pdf
SAGE 34,2020-05-07,SAGE Minutes,"SAGE 34 minutes: Coronavirus (COVID-19) response, 7 May 2020",Thirty-fourth SAGE meeting on COVID-19 - 7 May 2020,2020-05-29,https://www.gov.uk/government/publications/sage-minutes-coronavirus-covid-19-response-7-may-2020,https://assets.publishing.service.gov.uk/government/uploads/system/uploads/attachment_data/file/888813/S0404_Thirty-fourth_SAGE_meeting_on_Covid-19_.pdf
SAGE 34,2020-05-07,Dynamic CO-CIN report,"Dynamic CO-CIN report to SAGE and NERVTAG, 6 May 2020","Dynamic CO-CIN report to SAGE and NERVTAG, 6 May 2020",2020-05-20,https://www.gov.uk/government/publications/dynamic-co-cin-report-to-sage-and-nervtag-6-may-2020,https://assets.publishing.service.gov.uk/government/uploads/system/uploads/attachment_data/file/888251/s0333-co-cin-report-060520-sage34.pdf
SAGE 34,2020-05-07,SPI-B subgroup on Security and Policing,"Policing, protest and changes to COVID-19 control measures in the UK, 4 May 2020","Policing, protest and changes to COVID-19 control measures in the UK - 4 May 2020",2020-05-29,https://www.gov.uk/government/publications/policing-protest-and-changes-to-covid-19-control-measures-in-the-uk-4-may-2020,https://assets.publishing.service.gov.uk/government/uploads/system/uploads/attachment_data/file/888551/7a._SPI-B_Policing_Protest_and_Changes_to_COVID-19_Control_Measures_in_the_UK_20200504_S0331_Redacted.pdf
SAGE 34,2020-05-07,SPI-B,"SPI-B: Key behavioural issues relevant to test, trace, track and isolate - summary, 6 May 2020","SPI-B Summary: Key behavioural issues relevant to test, trace, track and isolate , 6 May 2020",2020-05-29,https://www.gov.uk/government/publications/spi-b-key-behavioural-issues-relevant-to-test-trace-track-and-isolate-summary-6-may-2020,https://assets.publishing.service.gov.uk/government/uploads/system/uploads/attachment_data/file/888751/4b._SPI-B__Key_Behavioural_Issues_Relevant_to_Test_J_Trace_J_Track_and_Isolate_20200506_S0327.pdf
SAGE 34,2020-05-07,NERVTAG,"NERVTAG: Case definitions for contact tracing, 7 May 2020",Paper for SAGE: Case definitions for contact tracing - 7 May 2020,2020-06-05,https://www.gov.uk/government/publications/nervtag-case-definitions-for-contact-tracing-7-may-2020,https://assets.publishing.service.gov.uk/government/uploads/system/uploads/attachment_data/file/890191/s0328-case-definitions-contact-tracing-070420-sage34.pdf
SAGE 34,2020-05-07,PHE,"PHE: Serological surveillance - summary report 3, 6 May 2020",Serological surveillance: summary report 3 - 6 May 2020,2020-06-05,https://www.gov.uk/government/publications/phe-serological-surveillance-summary-report-3-6-may-2020,https://assets.publishing.service.gov.uk/government/uploads/system/uploads/attachment_data/file/890194/s0337-serological-surveillance-summary-3-060520-sage34.pdf
SAGE 34,2020-05-07,Environmental and Modelling Group (EMG),"Risk Estimation to inform risk assessment, 7 May 2020",Risk Estimation to inform risk assessment - 7 May 2020,2020-06-12,https://www.gov.uk/government/publications/risk-estimation-to-inform-risk-assessment-7-may-2020,https://assets.publishing.service.gov.uk/government/uploads/system/uploads/attachment_data/file/891990/S0329_Risk_Estimation_to_inform_risk_assessment.pdf
SAGE 34,2020-05-07,SPI-M-O,"SPI-M-O: Statement on COVID-19 -“Bubbles” and outdoor activities, 6 May 2020",SPI-M-O: Statement on COVID-19 - “Bubbles” and outdoor activities - 6 May 2020,2020-06-12,https://www.gov.uk/government/publications/spi-m-o-statement-on-covid-19-bubbles-and-outdoor-activities-6-may-2020,https://assets.publishing.service.gov.uk/government/uploads/system/uploads/attachment_data/file/891926/S0330_SPI-M-O_Statement_on_COVID-19_-_Bubbles_and_outdoor_activities.pdf
SAGE 35,2020-05-12,SAGE Minutes,"SAGE 35 minutes: Coronavirus (COVID-19) response, 12 May 2020","Thirty-fifth SAGE meeting on Covid-19, 12 May 2020",2020-06-12,https://www.gov.uk/government/publications/sage-35-minutes-coronavirus-covid-19-response-12-may-2020,https://assets.publishing.service.gov.uk/government/uploads/system/uploads/attachment_data/file/892021/S0469_Thirty-fifth_SAGE_minute_on_Covid-19.pdf
SAGE 35,2020-05-12,CO-CIN,"Case fatality in hospitalised patients after 23 March 2020, 11 May 2020",Case fatality in hospitalised patients after 23 March 2020 - 11 May 2020,2020-05-22,https://www.gov.uk/government/publications/case-fatality-in-hospitalised-patients-after-23-march-2020-11-may-2020,https://assets.publishing.service.gov.uk/government/uploads/system/uploads/attachment_data/file/888645/s0341-co-cin-report-hospitalised-patients-outcomes-110520-sage35__1_.pdf
SAGE 35,2020-05-12,Dynamic CO-CIN report,"Dynamic CO-CIN report to SAGE and NERVTAG, 12 May 2020","Dynamic CO-CIN report to SAGE and NERVTAG, 12 May 2020",2020-05-20,https://www.gov.uk/government/publications/dynamic-co-cin-report-to-sage-and-nervtag-12-may-2020,https://assets.publishing.service.gov.uk/government/uploads/system/uploads/attachment_data/file/888253/s0349-co-cin-report-120520-sage35.pdf
SAGE 35,2020-05-12,Environmental and Modelling Group (EMG),"Possible additional interventions to address hospital transmission risks of SARS-CoV-2, 12 May 2020",Possible additional interventions to address hospital transmission risks of SARS-CoV-2 - 12 May 2020,2020-06-12,https://www.gov.uk/government/publications/possible-additional-interventions-to-address-hospital-transmission-risks-of-sars-cov-2-12-may-2020,https://assets.publishing.service.gov.uk/government/uploads/system/uploads/attachment_data/file/892014/S0344_Possible_additional_interventions_to_address_hospital_transmission_risks.pdf
SAGE 35,2020-05-12,SCWG,"SCWG: Care homes analysis, 12 May 2020",Care Home Analysis - 12 May 2020,2020-07-03,https://www.gov.uk/government/publications/care-homes-analysis-12-may-2020,https://assets.publishing.service.gov.uk/government/uploads/system/uploads/attachment_data/file/897497/S0343_Care_Homes_Analysis.pdf
SAGE 35,2020-05-12,SPI-M-O,"SPI-M-O: Consensus statement on COVID-19, 11 May 2020", SPI-M-O: Consensus Statement on COVID-19 - 11 May 2020,2020-07-31,https://www.gov.uk/government/publications/spi-m-o-consensus-statement-on-covid-19-11-may-2020,https://assets.publishing.service.gov.uk/government/uploads/system/uploads/attachment_data/file/904651/S0340_SAGE35_200511_SPI-M-O_Consensus_Statement.pdf
SAGE 35,2020-05-12,SPI-M-O,"SPI-M-O: COVID-19 short-term forecasts, 10 May 2020",Short term forecasts (S0339) - 10 May 2020,2020-09-11,https://www.gov.uk/government/publications/spi-m-o-covid-19-short-term-forecasts-10-may-2020,https://assets.publishing.service.gov.uk/government/uploads/system/uploads/attachment_data/file/917033/SAGE35_2a._20200511_forecasts_for_SAGE_S0339_for_release_v2.pdf
SAGE 35,2020-05-12,SPI-M-O,"SPI-M-O: COVID-19 planning scenarios and current estimates of severity and length of stay in hospital, 11 May 2020",SPI-M-O: Planning scenarios and current estimates of severity and length of stay - 11 May 2020,2020-10-16,https://www.gov.uk/government/publications/spi-m-o-covid-19-planning-scenarios-and-current-estimates-of-severity-and-length-of-stay-in-hospital-11-may-2020,https://assets.publishing.service.gov.uk/government/uploads/system/uploads/attachment_data/file/926900/S0345_SPI-M-O_Planning_scenarios_and_current_estimates_of_severity_and_length_of_stay.pdf
SAGE 36,2020-05-14,SAGE Minutes,"SAGE 36 minutes: Coronavirus (COVID-19) response, 14 May 2020","Thirty-sixth SAGE meeting on Covid-19, 14 May 2020",2020-06-12,https://www.gov.uk/government/publications/sage-36-minutes-coronavirus-covid-19-response-14-may-2020,https://assets.publishing.service.gov.uk/government/uploads/system/uploads/attachment_data/file/892023/S0466_Thirty-sixth_SAGE_meeting_on_Covid-19.pdf
SAGE 36,2020-05-14,Dynamic CO-CIN report,"Dynamic CO-CIN report to SAGE and NERVTAG, 13 May 2020","Dynamic CO-CIN report to SAGE and NERVTAG, 13 May 2020",2020-05-20,https://www.gov.uk/government/publications/dynamic-co-cin-report-to-sage-and-nervtag-13-may-2020,https://assets.publishing.service.gov.uk/government/uploads/system/uploads/attachment_data/file/888255/s0355-co-cin-report-130520-sage36.pdf
SAGE 36,2020-05-14,Environmental and Modelling Group (EMG),"Principles of understanding of transmission routes to inform risk assessment and mitigation strategies (updated), 14 May 2020",Principles of understanding of transmission routes to inform risk assessment and mitigation strategies - 14 May 2020,2020-06-12,https://www.gov.uk/government/publications/principles-of-understanding-of-transmission-routes-to-inform-risk-assessment-and-mitigation-strategies-updated-14-may-2020,https://assets.publishing.service.gov.uk/government/uploads/system/uploads/attachment_data/file/892016/S0354_Principles_of_understanding_of_transmission_routes_UPDATED.pdf
SAGE 36,2020-05-14,Environmental and Modelling Group (EMG),"Principles of understanding of transmission routes to inform risk assessment and mitigation strategies, 14 May 2020",Principles of understanding of transmission routes to inform risk assessment and mitigation strategies - 14 May 2020,2020-06-12,https://www.gov.uk/government/publications/principles-of-understanding-of-transmission-routes-to-inform-risk-assessment-and-mitigation-strategies-14-may-2020,https://assets.publishing.service.gov.uk/government/uploads/system/uploads/attachment_data/file/892015/S0353_Principles_of_understanding_of_transmission_routes.pdf
SAGE 36,2020-05-14,SPI-M-O,"SPI-M-O Statement on bubbles, 13 May 2020",SPI-M-O: Statement on “Bubbles” - 13 May 2020,2020-06-12,https://www.gov.uk/government/publications/spi-m-o-statement-on-bubbles-13-may-2020,https://assets.publishing.service.gov.uk/government/uploads/system/uploads/attachment_data/file/891927/S0357_SPI-M-O_Statement_on_Bubbles.pdf
SAGE 36,2020-05-14,SPI-B,"SPI-B - Well-being and Household Connection: the behavioural considerations of ‘Bubbles’, 14 May 2020",SPI-B: Well-being and Household Connection: the behavioural considerations of ‘Bubbles’  Executive summary - 14 May 2020,2020-06-12,https://www.gov.uk/government/publications/spi-b-well-being-and-household-connection-the-behavioural-considerations-of-bubbles-14-may-2020,https://assets.publishing.service.gov.uk/government/uploads/system/uploads/attachment_data/file/892048/S0356_SPI-B_Well-being_and_Household_Connection.pdf
SAGE 36,2020-05-14,NERVTAG,"NERVTAG: Asymptomatic SARS-CoV-2 infection, 13 May 2020",Asymptomatic SARS-CoV-2 infection - 13 May 2020,2020-06-19,https://www.gov.uk/government/publications/nervtag-asymptomatic-sars-cov-2-infection-13-may-2020,https://assets.publishing.service.gov.uk/government/uploads/system/uploads/attachment_data/file/893330/S0358_Asymptomatic_SARS-CoV-2_infection.pdf
SAGE 36,2020-05-14,NERVTAG,"NERVTAG: NT-SARS-CoV-2 variants, 13 May 2020",NT-SARS-CoV-2 variants - 13 May 2020,2020-06-19,https://www.gov.uk/government/publications/nervtag-nt-sars-cov-2-variants-13-may-2020,https://assets.publishing.service.gov.uk/government/uploads/system/uploads/attachment_data/file/893334/S0359_NT-SARS-CoV-2_Variants.pdf
SAGE 37,2020-05-19,SAGE Minutes,"SAGE 37 minutes: Coronavirus (COVID-19) response, 19 May 2020",Thirty-seventh SAGE meeting on Covid-19 - 19 May 2020,2020-06-19,https://www.gov.uk/government/publications/sage-37-minutes-coronavirus-covid-19-response-19-may-2020,https://assets.publishing.service.gov.uk/government/uploads/system/uploads/attachment_data/file/893667/S0467_Thirty-seventh_SAGE_meeting_on_Covid-19.pdf
SAGE 37,2020-05-19,EMG,"EMG: Transmission and Control of SARS-CoV-2 on Public Transport, 18 May 2020",Transmission and control of SARS-CoV-2 on public transport - 18 May 2020,2020-05-29,https://www.gov.uk/government/publications/emg-transmission-and-control-of-sars-cov-2-on-public-transport-18-may-2020,https://assets.publishing.service.gov.uk/government/uploads/system/uploads/attachment_data/file/888755/4b._EMG-Transport_Overview_18502020-updated_S0407.pdf
SAGE 37,2020-05-19,EMG,"EMG: Summary of disinfection technologies for microbial control, 18 May 2020",Summary of disinfection technologies for microbial control - 18 May 2020,2020-05-29,https://www.gov.uk/government/publications/emg-summary-of-disinfection-technologies-for-microbial-control-18-may-2020,https://assets.publishing.service.gov.uk/government/uploads/system/uploads/attachment_data/file/888753/4a._EMG_-_Summary_disinfection_18052020_S0406.pdf
SAGE 37,2020-05-19,DELVE,"DELVE: Report on test, trace, isolate and support, 18 May 2020","DELVE report on test, trace, isolate and support - 18 May 2020",2020-06-19,https://www.gov.uk/government/publications/delve-report-on-test-trace-isolate-and-support-18-may-2020,https://assets.publishing.service.gov.uk/government/uploads/system/uploads/attachment_data/file/893312/S0412_DELVE_Report_on_Test__Trace__Isolate_and_Support.pdf
SAGE 37,2020-05-19,Dynamic CO-CIN report,"Dynamic CO-CIN report to SAGE and NERVTAG, 18 May 2020",Dynamic CO-CIN report to SAGE and NERVTAG - 18 May 2020,2020-06-19,https://www.gov.uk/government/publications/dynamic-co-cin-report-to-sage-and-nervtag-18-may-2020,https://assets.publishing.service.gov.uk/government/uploads/system/uploads/attachment_data/file/893493/S0439_Dynamic_CO-CIN_report_to_SAGE_and_NERVTAG.pdf
SAGE 37,2020-05-19,ONS,"Quick findings on age distributions of grandparents and parents of primary school aged children, 18 May 2020",Quick findings on age distributions of grandparents and parents of primary school aged children - 18 May 2020,2020-06-19,https://www.gov.uk/government/publications/quick-findings-on-age-distributions-of-grandparents-and-parents-of-primary-school-aged-children-18-may-2020,https://assets.publishing.service.gov.uk/government/uploads/system/uploads/attachment_data/file/893429/S0409_Age_distributions_of_grandparents_and_parents_of_primary_school_aged_children.pdf
SAGE 37,2020-05-19,EMG,"EMG: Application of UV disinfection, visible light, local air filtration and fumigation technologies to microbial control, 19 May 2020","Application of UV disinfection, visible light, local air filtration and fumigation - 19 May 2020",2020-07-31,https://www.gov.uk/government/publications/emg-application-of-uv-disinfection-visible-light-local-air-filtration-and-fumigation-technologies-to-microbial-control-19-may-2020,https://assets.publishing.service.gov.uk/government/uploads/system/uploads/attachment_data/file/904656/S0440_EMG_-_Application_of_UV_disinfection__visible_light__local_air_filtration_and_fumigation.pdf
SAGE 37,2020-05-19,EMG,"EMG: Evidence for transmission of SARS-CoV-2 on ground public transport and potential effectiveness of mitigation measures, 18 May 2020", EMG: Evidence for transmission of SARS-CoV-2 on ground public transport - 18 May 2020,2020-07-31,https://www.gov.uk/government/publications/emg-evidence-for-transmission-of-sars-cov-2-on-ground-public-transport-and-potential-effectiveness-of-mitigation-measures-18-may-2020,https://assets.publishing.service.gov.uk/government/uploads/system/uploads/attachment_data/file/904663/S0441_EMG_-_Evidence_for_transmission_of_SARS-COV-2_on_ground_public_transport.pdf
SAGE 37,2020-05-19,SPI-M-O,"SPI-M-O: COVID-19 short-term forecasts, 17 May 2020",Short term forecasts (S0408) - 17 May 2020,2020-09-11,https://www.gov.uk/government/publications/spi-m-o-covid-19-short-term-forecasts-17-may-2020,https://assets.publishing.service.gov.uk/government/uploads/system/uploads/attachment_data/file/917036/SAGE37_2a._20200518_forecasts_equal_weight_SAGE_S0408_for_release_v2.pdf
SAGE 38,2020-05-21,SAGE Minutes,"SAGE 38 minutes: Coronavirus (COVID-19) response, 21 May 2020","Thirty-eighth SAGE meeting on COVID-19, 21 May 2020",2020-06-19,https://www.gov.uk/government/publications/sage-38-minutes-coronavirus-covid-19-response-21-may-2020,https://assets.publishing.service.gov.uk/government/uploads/system/uploads/attachment_data/file/893665/S0424_Thirty-eighth_SAGE_meeting_on_Covid-19__1_.pdf
SAGE 38,2020-05-21,GOS,"GOS: Risk of COVID-19 amongst parents and grandparents of primary school children, 21 May 2020",Risk of COVID-19 amongst parents and grandparents of primary school children - 21 May 2020,2020-06-19,https://www.gov.uk/government/publications/gos-risk-of-covid-19-amongst-parents-and-grandparents-of-primary-school-children-21-may-2020,https://assets.publishing.service.gov.uk/government/uploads/system/uploads/attachment_data/file/893497/S0421_Risk_of_COVID-19_amongst_parents_and_grandparents_of_primary_school_children_.pdf
SAGE 38,2020-05-21,Dynamic CO-CIN report,"Dynamic CO-CIN report to SAGE and NERVTAG, 21 May 2020",Dynamic CO-CIN report to SAGE and NERVTAG - 21 May 2020,2020-06-19,https://www.gov.uk/government/publications/dynamic-co-cin-report-to-sage-and-nervtag-21-may-2020,https://assets.publishing.service.gov.uk/government/uploads/system/uploads/attachment_data/file/893440/S0428_Dynamic_CO-CIN_Report_to_SAGE_and_NERVTAG__1_.pdf
SAGE 38,2020-05-21,Evaluation Sub Group,"Evaluation Sub Group: Note on the Joint Biosecurity Centre, 20 May 2020",Evaluation Sub Group Note on the Joint Biosecurity Centre - 20 May 2020,2020-06-26,https://www.gov.uk/government/publications/evaluation-sub-group-note-on-the-joint-biosecurity-centre-20-may-2020,https://assets.publishing.service.gov.uk/government/uploads/system/uploads/attachment_data/file/895846/S0417_Evaluation_Sub_Group_-_Note_on_JBC.pdf
SAGE 38,2020-05-21,JBC,"JBC: Note on Joint Biosecurity Centre and potential flows, 20 May 2020",Note on Joint Biosecurity Centre (JBC) and potential flows - 20 May 2020,2020-06-26,https://www.gov.uk/government/publications/jbc-note-on-joint-biosecurity-centre-and-potential-flows-20-may-2020,https://assets.publishing.service.gov.uk/government/uploads/system/uploads/attachment_data/file/895847/S0418_Note_on_JBC_and_potential_flows.pdf
SAGE 38,2020-05-21,SPI-M-O,"SPI-M-O: Comments on social distancing, 20 May 2020",SPI-M-O: Comments on social distancing - 20 May 2020,2020-06-26,https://www.gov.uk/government/publications/spi-m-o-comments-on-social-distancing-20-may-2020,https://assets.publishing.service.gov.uk/government/uploads/system/uploads/attachment_data/file/895858/S0419_200520_SPI-M-O_Statement_on_Social_Distancing_Measures.pdf
SAGE 38,2020-05-21,TFC,"TFC: Comments on sequencing of social distancing measures (schools), 20 May 2020",Children’s Task and Finish Group: Comments on sequencing of social distancing measures (schools) - 20 May 2020,2020-06-26,https://www.gov.uk/government/publications/tfc-comments-on-sequencing-of-social-distancing-measures-schools-20-may-2020,https://assets.publishing.service.gov.uk/government/uploads/system/uploads/attachment_data/file/895859/S0420_TFC_Comments_on_Sequencing_of_Social_Distancing_Measures__Schools_.pdf
SAGE 38,2020-05-21,SPI-M-O,"SPI-M-O: Consensus statement on COVID-19, 20 May 2020",SPI-M-O: Consensus Statement on COVID-19 - 20 May 2020,2020-06-26,https://www.gov.uk/government/publications/spi-m-o-consensus-statement-on-covid-19-20-may-2020,https://assets.publishing.service.gov.uk/government/uploads/system/uploads/attachment_data/file/895860/S0423_SAGE_38_200520_SPI-M-O_Consensus_Statement_on_Covid-19.pdf
SAGE 38,2020-05-21,SPI-M-O,"SPI-M-O: COVID-19 planning and reasonable worst-case scenarios, 20 May 2020",SPI-M-O: Planning and reasonable worst-case scenarios - 20 May 2020,2020-10-16,https://www.gov.uk/government/publications/spi-m-o-covid-19-planning-and-reasonable-worst-case-scenarios-20-may-2020,https://assets.publishing.service.gov.uk/government/uploads/system/uploads/attachment_data/file/926903/S0414_SPI-M-O_Planning_and_reasonable_worst-case_scenarios.pdf
